"annotation_id","annotator","answer","created_at","id","label","lead_time","notes","quality","question","updated_at"
1,"1","An evaluation framework helps measure the quality of model outputs, detect regressions, and compare versions consistently.","2025-11-16T22:29:25.683567Z",1,"good",20.333,"Correct and relevant.","good","What is the purpose of an evaluation framework when working with LLMs?","2025-11-16T22:29:25.683584Z"
2,"1","Overfitting happens when a model memorizes the training data but performs poorly on new data.","2025-11-16T22:29:33.724746Z",2,"good",7.875,"Accurate and concise.","good","Explain overfitting in simple terms.","2025-11-16T22:29:33.724763Z"
3,"1","Because we need one part of the data to train the model and another part to check if it generalizes.","2025-11-16T22:29:45.680837Z",3,"good",11.8,"Correct reasoning.","good","Why do we use a train/test split in machine learning?","2025-11-16T22:29:45.680853Z"
4,"1","TF-IDF counts how often words appear, adjusts for how common they are across documents, and turns text into weighted vectors.","2025-11-16T22:30:12.695463Z",4,"good",26.847,"High-level correct explanation.","good","What are the main steps of the TF-IDF algorithm?","2025-11-16T22:30:12.695480Z"
5,"1","A decision tree is useful when you want an interpretable model that explains decisions from conditions.","2025-11-16T22:30:32.598742Z",5,"good",19.752,"Good, clear explanation.","","Give one example of when you should use a decision tree.","2025-11-16T22:30:32.598760Z"
6,"1","An MCP Server exposes structured tools and data to LLMs through a standardized interface, allowing models to interact with external systems safely.","2025-11-16T22:30:59.360662Z",6,"good",15.577,"Correct and domain-relevant.","good","Explain what an MCP Server is and what it provides.","2025-11-16T22:30:59.360678Z"
7,"1","Rate limiting prevents abuse, protects backend resources, and ensures fair usage across clients.","2025-11-16T22:31:12.903308Z",7,"good",13.375,"Accurate and complete.","good","Why is rate limiting important in APIs?","2025-11-16T22:31:12.903322Z"
